source,link,extracted_text,published
finance.yahoo.com,https://finance.yahoo.com/news/unplugged-performance-showcase-tesla-builds-212700160.html?.tsrc=rss,"3/4 Shot of 2024 Tesla Model 3 Performance with Unplugged Performance Carbon Fiber Aero Kit, UP Forged UP-03 Wheels, and Rear Dual Wing

2024 Tesla Model 3 Performance with Unplugged Performance Carbon Fiber Aero Kit, UP Forged UP-03 Wheels, and Rear Dual Wing

2024 Tesla Model 3 Performance with Unplugged Performance Carbon Fiber Front Aero Kit

2024 Tesla Model 3 Performance with Unplugged Performance Carbon Fiber Front Aero Kit, UP Forged UP-03 Wheels

Birdseye view of a Tesla Model 3 Performance Highland with Carbon Fiber Aero Kit and UP Forged UP-03 Wheels

Tesla Model Y with Leveling Lift Kit

2026 Tesla Model Y with Leveling Lift Kit and UP Forged UP-05 Wheels

2026 Tesla Model Y with Leveling Lift Kit and UP Forged UP-05 ""Off-Road Spec"" Wheels

2026 Tesla Model Y with UP Forged CYBRHEX Wheels

Tesla Model Y Juniper with 22"" UP Forged CYBRHEX Wheels

Tesla Cybertruck INVINCIBLE build with 22"" UP Forged CYBRHEX

LOS ANGELES, June 20, 2025 (GLOBE NEWSWIRE) -- Unplugged Performance, the world leader in Tesla-focused performance upgrades, is headed to Electrify Expo, North America’s premier electric vehicle lifestyle event. Taking place this weekend June 21st & 22nd, Electrify Expo invites EV enthusiasts, media, and families for an immersive look at the future of electrification.

Unplugged Performance will be displaying four of its latest builds at the show, each with upgrades tailored for parts performance, durability, and everyday driving.

Tesla Model 3 Performance “Red Rocket” Track Build

Built to dominate the track and the streets, car features our:

UP Race Pro Coilovers with Adaptive Canceller

UP Carbon Fiber Front Aero Kit + Rear Dual Spoiler and Wing Set Up + Rear Spats and Diffuser

18x10.9 UP-03 Forged Wheels

Yokohama ADVAN A052 295/35R18 Tires

Satin Red 2026 Tesla Model Y Off-Road/Street Build

Adventure-ready, this MY build includes our:

UP 35mm Leveling Lift Kit

Off-Road Spec 18"" UP-05 Forged Wheels

Off-Road Sway Bar + End Links

Yokohama GEOLANDAR Tires

UP INVINCIBLE® Cybertruck Street Build

The ultimate Tesla Cybertruck to take on anything on earth and beyond with:

HD Front & Rear Bumpers, Bull Bar, Rock Sliders

Carbon Fiber Hood w/ 50” LED Light Bar

Side Sail Panel MOLLE Rack System

22” CYBRHEX Forged Wheels

Yokohama GEOLANDAR Tires

Quicksilver 2026 Tesla Model Y Off-Road/Street Build

Ready for the streets, this MY build includes our:

22” UP Forged CYBRHEX Wheels

Moderate option Dual Rate Lowering Springs

Yokohama Parada Spex-X Tires

Learn more about our products at unpluggedperformance.com",2025-06-20 21:27:00
www.thestreet.com,https://www.thestreet.com/technology/veteran-tesla-bull-just-made-one-of-his-boldest-robotaxi-calls-yet-?.tsrc=rss,The next big growth chapter for Tesla stock may be closer than you think,2025-06-20 20:59:55
www.barchart.com,https://www.barchart.com/story/news/32980934/stocks-settle-mostly-lower-as-chip-makers-fall?.tsrc=rss,"The S&amp;P 500 Index ($SPX ) (SPY ) Friday closed down -0.22%, the Dow Jones Industrials Index ($DOWI ) (DIA ) closed up +0.08%, and the Nasdaq 100 Index ($IUXX ) (QQQ ) closed down -0.43%. September E-mini S&amp;P futures (ESU25 ) are down -0.21%, and September E-mini Nasdaq futures...",2025-06-20 20:51:36
www.fool.com,https://www.fool.com/investing/2025/06/22/brilliant-growth-stocks-buy-now-hold-long-term/?.tsrc=rss,"Not all of the growth stocks featured here will likely deliver outsize returns, so it makes sense to spread portfolio risk around a collection of holdings. In that line of thought, here are 10 growth stock ideas for investors to consider. They range from a couple of high-profile household names, such as Tesla (TSLA -0.09%) and Delta Air Lines (DAL -0.76%), to companies like Navitas Semiconductor (NVTS 0.14%) and Synopsys (SNPS -0.71%), which are less well known.

You might want to consider buying and holding any (or all) of these equities long-term.

Tesla's robotaxis are a game-changer

The key to the investment case for Tesla lies in its promised robotaxis and unsupervised full self-driving (FSD) software, which is scheduled to launch on a limited basis beginning this week. Tesla is already a highly successful automaker and the dominant player in electric vehicles (EVs) in the U.S., and robotaxis offer the prospect of transforming it into a company able to generate high-margin and recurring revenue from owning its robotaxi fleet or revenue sharing from Tesla's transformed fleet using Full Self-Driving (FSD) software.

There's also the dedicated robotaxi, Cybercab, and the potential to sell FSD on a subscription basis. And all of it will be supported by Tesla's market-leading position in EVs and its ability to develop affordable EVs in the future.

Next-generation data centers

Nvidia partners Navitas Semiconductor and Vertiv (VRT -0.45%) and the next generation of data centers, namely 800-volt (V) high voltage direct current (HVDC), which I've discussed in more detail elsewhere, so investors with the time and inclination can peruse. Nvidia believes they will be more efficient, with lower maintenance costs and significantly lower costs of ownership.

The new data centers, scheduled for 2027, employ a different power conversion method, and Navitas is developing Gallium Nitride (GaN) and Silicon Carbide (SiC) power semiconductors to enable more efficient power conversion in 800V HVDC data centers.

Similarly, another Nvidia partner, and leading data center equipment provider, Vertiv, is developing critical power and cooling equipment and systems for the new data centers and expects to have them available in the second half of 2026, in time for the launch of the 800V HVDC data center in 2027.

What makes both companies particularly interesting is that, unlike their rivals, they are more like pure plays in their end markets. For example, Navitas specializes in GaN and SiC chips for power conversion (not silicon), and 80% of Vertiv's revenue comes from data centers.

Aehr Test Systems is opening up new end markets

Speaking of SiC and GaN chips, Aehr's (AEHR -3.13%) stock has soared recently on speculation that Navitas might be a customer for Aehr's testing and burn-in equipment. Aehr's equipment helps semiconductor manufacturers ensure quality and reliability throughout the manufacturing process.

Aehr has struggled recently as its revenue at SiC customers, including ON Semiconductor, has declined in light of pullbacks in EV investment. Still, Aehr is making good progress in opening up and winning customers in new markets, including GaN semiconductors and semiconductors for artificial intelligence (AI) processing.

Synopsys and the future of semiconductors

Synopsys is a leader in electronic design automation software (used to design and verify chips), and its intended acquisition of engineering simulation and analysis company Ansys is a key event. The aim is to create a company offering design software, as well as simulation and analysis software to test the fruits of the design. It will also open up Synopsys' solutions to Ansys' wider range of end-market customers, particularly as semiconductors and electronics are increasingly being embedded in a range of new industries.

Hexcel is the future of aerospace

The advanced materials company's lightweight composites are the future of the aerospace industry, as every new generation of airplane contains more composites. This means Hexcel (HXL 0.07%) can grow as airplane production increases (Airbus and Boeing have multiyear backlogs in place) and new, more composite-rich airplanes are developed.

Hexcel has faced headwinds in recent years as Airbus' and Boeing's delivery rates have fallen short of expectations, but it's only a matter of time before they improve.

Cognex's machine vision has long-term growth prospects

Cognex (CGNX -1.33%) is another company with excellent long-term secular growth prospects (the use of machine vision in automated processes) that has suffered near-term headwinds (weakness in key end markets like automotive and consumer electronics). Still, this is a temporary slowdown in a long-term growth story.

PTC, Trimble, and the growing interface between the digital and physical worlds

PTC (PTC 0.28%) provides computer-aided design (CAD), product lifecycle management (PLM), and other solutions essential to creating a so-called ""digital thread"" for a physical product as it moves from design through manufacturing, use, servicing, and ultimately disposal. As such, it's a leading player in the digitization of the industrial sector.

Trimble's (TRMB 0.18%) precise positioning hardware (its origins) and growing software/services also make it a leading play on digitization. In Trimble's case, it's about integrating physical positioning with the digital world, such as in construction and infrastructure work, transportation, and geospatial activities. Through the use of advanced analytics in the digital world, Trimble's solutions can be integrated into its customers' daily workflows.

Delta Air Lines is different now",2025-06-22 09:10:00
